{"archive":{"bytes":495843,"commit":"1dec047f161d1e7d8d43b9bf62e90295144e05a8","path":"archives/sc-marker-dotplot-highlight-boxes/1.0.2/sc-marker-dotplot-highlight-boxes-1.0.2.zip","repository":"jarxunlai/ScientificFigureLibrary-community-archives","sha256":"864c404fabd818c979e3bb05dfca93e285bd60015858a0ba7cf96dffe71a4b08"},"contentDigest":"83d8b9f1d5e5b733d68a16b6fe6bbd0cd0d2437e0d9d3f507593254cb671297f","description":"对照 Nat Immunol 2026 Fig.1b：11 个命名胸腺 DC cluster、23 个基因、三个黑框标 cDC1/cDC2/aDC。合成 DotPlot 表。公开包入口支持 Rscript render.R --input-dir <payload/data> --output <preview.png>。预览为 Archive Linux 沙箱重绘 PNG。","immutableEntrySha256":"7faff2157e2419747fd57d562eda3b780b0e149fa46d1b5ef6279f6f7ac1893c","language":"R","licenses":{"code":"MIT","documentation":null,"preview":"CC-BY-4.0","syntheticData":"CC-BY-4.0"},"preview":{"bytes":509980,"canonicalRgbaSha256":"9871e8bf3f909eee0b9ef49ff9cede5616f6a4db332bdbf360c60ef9f730998a","height":2580,"mediaType":"image/png","path":"catalog/thumbs/sc-marker-dotplot-highlight-boxes/1.0.2.png","sha256":"c32bed9ea0c069c39515113953827d192c1ffe93cbbe3a8e65e583a3247e44bb","width":2460},"provenance":[{"type":"doi","value":"10.1038/s41590-025-02371-9"},{"type":"note","value":"Authored reconstruction from the publisher local plot gallery. Public payload includes only MIT R plotting code, one synthetic example table, and one generated PNG preview from the Archive Linux sandbox. Third-party screenshots, evidence, documentation with local gallery commands, and private lifecycle state are excluded."},{"type":"inspiration","value":"Layout is inspired by a published scientific figure grammar; this release does not redistribute paper or WeChat source images."}],"providerId":"io.github.jarxunlai.scientific-figure-community","publicAssetKind":"plot_template","releaseState":"active","releaseVersion":"1.0.2","schema":"figure-library.public-template-entry.v2","search":{"application":"11 命名列；23 斜体基因；三个黑框。","codeFiles":["payload/code/render.R"],"dataProfile":"features.plot × id × avg.exp.scaled × pct.exp。","inputFiles":["payload/data/dot-csv.csv"],"packages":[],"plotFamily":"dotplot","tags":["Nat Immunol","R","dotplot","ggplot2","marker","thymic DC"]},"status":{"curationStatus":"curated","localReviewStatus":"not_reviewed","plotExecutionByRecipient":"not_run","publisherVerified":true,"renderValidation":"ci_rendered","upstreamStatus":"published"},"templateId":"sc-marker-dotplot-highlight-boxes","title":"单细胞marker气泡图加突出框","withdrawal":null}
